{
  "id": "GHSA-4g53-vp7q-gfjv",
  "aliases": [],
  "affected": [
    {
      "package": {
        "ecosystem": "npm",
        "name": "@worker-tools/stripe-webhook"
      },
      "symbols": [
        "constructEvent"
      ]
    }
  ],
  "evidence": {
    "source": "advisory_text",
    "confidence": "medium",
    "excerpt": "via this library's `constructEvent` function"
  }
}
