{
  "id": "GHSA-m6w8-fq7v-ph4m",
  "aliases": [],
  "affected": [
    {
      "package": {
        "ecosystem": "npm",
        "name": "@openzeppelin/contracts"
      },
      "symbols": [
        "explicit"
      ]
    },
    {
      "package": {
        "ecosystem": "npm",
        "name": "@openzeppelin/contracts-upgradeable"
      },
      "symbols": [
        "explicit"
      ]
    }
  ],
  "evidence": {
    "source": "advisory_text",
    "confidence": "medium",
    "excerpt": "using explicit function"
  }
}
