{
  "id": "GHSA-8cf7-32gw-wr33",
  "aliases": [
    "CVE-2022-23539"
  ],
  "affected": [
    {
      "package": {
        "ecosystem": "npm",
        "name": "jsonwebtoken"
      },
      "symbols": [
        "sign",
        "verify"
      ]
    }
  ],
  "evidence": {
    "source": "advisory_text+fix_commit",
    "confidence": "high",
    "excerpt": "in the `sign()` and/or `verify()` functions",
    "fixCommit": "https://github.com/auth0/node-jsonwebtoken/commit/e1fa9dcc12054a8681db4e6373da1b30cf7016e3"
  }
}
