{
  "id": "GHSA-9f2h-7v79-mxw3",
  "aliases": [
    "CVE-2025-62374"
  ],
  "affected": [
    {
      "package": {
        "ecosystem": "npm",
        "name": "parse"
      },
      "symbols": [
        "Object"
      ]
    }
  ],
  "evidence": {
    "source": "advisory_text",
    "confidence": "medium",
    "excerpt": "in `Parse.Object` and internal APIs",
    "fixCommit": "https://github.com/parse-community/Parse-SDK-JS/commit/00973987f361368659c0c4dbf669f3897520b132"
  }
}
