{
  "id": "GHSA-34gh-3cwv-wvp2",
  "aliases": [
    "CVE-2020-7683"
  ],
  "affected": [
    {
      "package": {
        "ecosystem": "npm",
        "name": "rollup-plugin-server"
      },
      "symbols": [
        "readFileFromContentBase"
      ]
    }
  ],
  "evidence": {
    "source": "advisory_text",
    "confidence": "medium",
    "excerpt": "inside the readFileFromContentBase function"
  }
}
