{
  "id": "GHSA-529q-4j3p-7c5r",
  "aliases": [
    "CVE-2025-3193"
  ],
  "affected": [
    {
      "package": {
        "ecosystem": "npm",
        "name": "algoliasearch-helper"
      },
      "symbols": [
        "_merge"
      ]
    }
  ],
  "evidence": {
    "source": "advisory_text",
    "confidence": "medium",
    "excerpt": "in the _merge() function"
  }
}
