{
  "id": "GHSA-vrhw-v2hw-jffx",
  "aliases": [
    "CVE-2026-25228"
  ],
  "affected": [
    {
      "package": {
        "ecosystem": "npm",
        "name": "signalk-server"
      },
      "symbols": [
        "validateAppId"
      ]
    }
  ],
  "evidence": {
    "source": "advisory_text",
    "confidence": "medium",
    "excerpt": "in SignalK Server's `applicationData` API",
    "fixCommit": "https://github.com/SignalK/signalk-server/commit/9bcf61c8fe2cb8a40998b913a02fb64dff9e86c7"
  }
}
