{
  "id": "GHSA-c429-5p7v-vgjp",
  "aliases": [
    "CVE-2020-36604"
  ],
  "affected": [
    {
      "package": {
        "ecosystem": "npm",
        "name": "@hapi/hoek"
      },
      "symbols": [
        "clone"
      ]
    },
    {
      "package": {
        "ecosystem": "npm",
        "name": "hoek"
      },
      "symbols": [
        "clone"
      ]
    }
  ],
  "evidence": {
    "source": "advisory_text+fix_commit",
    "confidence": "high",
    "excerpt": "via the clone function",
    "fixCommit": "https://github.com/hapijs/hoek/commit/4d0804bc6135ad72afdc5e1ec002b935b2f5216a"
  }
}
