{
  "id": "GHSA-g956-2f74-rmv7",
  "aliases": [
    "CVE-2026-55100"
  ],
  "affected": [
    {
      "package": {
        "ecosystem": "npm",
        "name": "hashi-vault-js"
      },
      "symbols": [
        "encodeURIComponent"
      ]
    }
  ],
  "evidence": {
    "source": "advisory_text+fix_commit",
    "confidence": "high",
    "excerpt": "using `encodeURIComponent()` before supply them to the library's functions",
    "fixCommit": "https://github.com/kyndryl-open-source/hashi-vault-js/commit/ea2f76052d366a08f35f62ef4c12b6a334c91ec2"
  }
}
