{
  "id": "GHSA-xqg6-98cw-gxhq",
  "aliases": [
    "CVE-2026-25150"
  ],
  "affected": [
    {
      "package": {
        "ecosystem": "npm",
        "name": "@builder.io/qwik-city"
      },
      "symbols": [
        "formToObj"
      ]
    }
  ],
  "evidence": {
    "source": "advisory_text",
    "confidence": "medium",
    "excerpt": "in the `formToObj()` function",
    "fixCommit": "https://github.com/QwikDev/qwik/commit/5f65bae2bc33e6ca0c21e4cfcf9eae05077716f7"
  }
}
