{
  "id": "GHSA-5g97-whc9-8g7j",
  "aliases": [
    "CVE-2023-26111"
  ],
  "affected": [
    {
      "package": {
        "ecosystem": "npm",
        "name": "@nubosoftware/node-static"
      },
      "symbols": [
        "startsWith"
      ]
    },
    {
      "package": {
        "ecosystem": "npm",
        "name": "node-static"
      },
      "symbols": [
        "startsWith"
      ]
    }
  ],
  "evidence": {
    "source": "advisory_text",
    "confidence": "medium",
    "excerpt": "in the startsWith() method"
  }
}
